{
 "schema_version": 1,
 "run_ts": "2000-01-01T00:00:00Z",
 "module_id": "c1-r103",
 "tool_version": "0.2.1",
 "config_digest": "2d654a20ec10a7aa978f2bb34c5d9ede8aeb0582397773d8866f11b896692482",
 "institution_profile": "generic",
 "unit_code": "X101",
 "skills_invoked": [
  "lt-module-capture",
  "lt-module-answer",
  "mechanistic-diagram",
  "lt-module-fill"
 ],
 "timings": {
  "lt-module-capture": 10000,
  "lt-module-answer": 20000,
  "mechanistic-diagram": 30000,
  "lt-module-fill": 40000
 },
 "token_cost": {
  "lt-module-capture": 2000,
  "lt-module-answer": 3000,
  "mechanistic-diagram": 4000,
  "lt-module-fill": 5000
 },
 "question_type_census": {
  "upload-and-annotate": 2,
  "image-annotation": 2,
  "image-labeling": 2,
  "drag-and-drop-labeling": 1,
  "categorization": 1
 },
 "selector_events": [
  {
   "selector": "input[type=file][accept*='image/png']",
   "item_type": "upload-and-annotate",
   "outcome": "hit"
  }
 ],
 "diff_classification": [
  {
   "item_id": "p2-11",
   "class": "provenance",
   "before": "[T4:10.5555/fixture.0001]",
   "after": "removed",
   "steered_run_wrong": true,
   "note": "The draft cited a paper for a point the figure already shows. Cite deeper tiers only when the prompt asks for the depth."
  }
 ],
 "outcome": "degraded",
 "notes": "Synthetic fixture record."
}
